,creatorid,post_id,title,caption,likes,thumbnail_url,url,date_utc,typename,caption_hashtags,is_video,audio_url,audio_transcript,en_audio_transcript
37,hydrationceo,C2qCP77JcEc,,"This goes out to all my breakout besties 😉 @herocosmetics #heropartner 

#winterskincare #skincareroutine #skincare #acneprone #acneroutine",1262,posts\2024-01-28_20-09-04_UTC.jpg,posts\2024-01-28_20-09-04_UTC.mp4,2024-01-28 20:09:04,GraphVideo,"['heropartner', 'winterskincare', 'skincareroutine', 'skincare', 'acneprone', 'acneroutine']",True,audio_output/2024-01-28_20-09-04_UTC.mp3,"This one is for my besties who are breaking out, but are on a budget. And I partnered with Hero to show you the routine. First off, we gotta cleanse. Even if you've just been rotting in bed all day, I love using the Hero Gentle Lovely Cleanser during the winter. It's super soft and it's only $15. Next is the Clarifying Prebiotic Moisturizer, also from Hero. This is only 13 bucks. This is like the perfect texture. It's moisturizing and makes my skin feel soft. For my post-blemish areas, we're going in with one of my favorite products of all time. This is Rescue Balm. Such a nourishing formula. I just dab this on in the night. In the morning, I am good to go. For a spot treatment, we're keeping it super gentle because my skin is already crispy. Going in with the Mighty Patch Original. Love the Mighty Patch in particular because these don't fall off in the middle of the night. And that's the routine. Quick, easy, simple. You're welcome.","This one is for my besties who are breaking out, but are on a budget. And I partnered with Hero to show you the routine. First off, we gotta cleanse. Even if you've just been rotting in bed all day, I love using the Hero Gentle Lovely Cleanser during the winter. It's super soft and it's only $15. Next is the Clarifying Prebiotic Moisturizer, also from Hero. This is only 13 bucks. This is like the perfect texture. It's moisturizing and makes my skin feel soft. For my post-blemish areas, we're going in with one of my favorite products of all time. This is Rescue Balm. Such a nourishing formula. I just dab this on in the night. In the morning, I am good to go. For a spot treatment, we're keeping it super gentle because my skin is already crispy. Going in with the Mighty Patch Original. Love the Mighty Patch in particular because these don't fall off in the middle of the night. And that's the routine. Quick, easy, simple. You're welcome."
38,hydrationceo,C2pceX8rxjC,,"Christening my millionth bottle of cosrx propolis light ampoule with a story about why I love it so much for acne-prone skin ⭐️ 

#cosrxpropolis #cosrxpropolisampoule #propolis #propolisskincare #skincare #acne #acnescars #acnemarks #hyperpigmentation #acneproneskin #skincare #skincaresecrets",3084,posts\2024-01-28_14-38-56_UTC.jpg,posts\2024-01-28_14-38-56_UTC.mp4,2024-01-28 14:38:56,GraphVideo,"['cosrxpropolis', 'cosrxpropolisampoule', 'propolis', 'propolisskincare', 'skincare', 'acne', 'acnescars', 'acnemarks', 'hyperpigmentation', 'acneproneskin', 'skincare', 'skincaresecrets']",True,audio_output/2024-01-28_14-38-56_UTC.mp3,"I feel like when people talk about acne and acne scars, they are always talking about the same ingredients. It's always vitamin C or ozolaic or like another exfoliating acid. And all these are great. I use all these. But if all you were doing is exfoliating your skin, that is going to really fuck up your skincare barrier. Skin barrier, not skincare barrier. And that is why this is like my favorite serum. Like that was literally the last drop that I had. Don't worry, I always have backups. Anyway, this is the COSRX Propolis Light Ampoule. I talk about this all the time. And this is not an active, this is a wound healing serum. Like people have been using Propolis forever for like gashes, which kind of makes it perfect for acne prone skin. Because when you think about it, like a lot of acne is an open wound. And obviously when that like pimple pops, you are dealing with literally an open wound on your face. So not only is it giving you like all over glow without any like exfoliating ingredients, but it's also like literally helping broken skin repair itself. And that is why it's been in my routine for like years and years. So if you're feeling like stuck on your acne and hyperpigmentation journey, I feel like this is a good little booster. Like this is the one to try if you've tried everything else. Like my tretinoin purge scars, they would not have healed as nicely without this. But anyway, I hope this helps. Bye.","I feel like when people talk about acne and acne scars, they are always talking about the same ingredients. It's always vitamin C or ozolaic or like another exfoliating acid. And all these are great. I use all these. But if all you were doing is exfoliating your skin, that is going to really fuck up your skincare barrier. Skin barrier, not skincare barrier. And that is why this is like my favorite serum. Like that was literally the last drop that I had. Don't worry, I always have backups. Anyway, this is the COSRX Propolis Light Ampoule. I talk about this all the time. And this is not an active, this is a wound healing serum. Like people have been using Propolis forever for like gashes, which kind of makes it perfect for acne prone skin. Because when you think about it, like a lot of acne is an open wound. And obviously when that like pimple pops, you are dealing with literally an open wound on your face. So not only is it giving you like all over glow without any like exfoliating ingredients, but it's also like literally helping broken skin repair itself. And that is why it's been in my routine for like years and years. So if you're feeling like stuck on your acne and hyperpigmentation journey, I feel like this is a good little booster. Like this is the one to try if you've tried everything else. Like my tretinoin purge scars, they would not have healed as nicely without this. But anyway, I hope this helps. Bye."
39,hydrationceo,C2nw5zsr-AN,,"It’s covergirl yummy gloss in ‘my strawbooty’ 🍓 

#affordablemakeup #makeup #princesspeachlips #glossylips #lipoil #makeuphacks #juicylips #drugstoremakeup #drugstoremakeupmusthaves",1621,posts\2024-01-27_22-58-51_UTC.jpg,posts\2024-01-27_22-58-51_UTC.mp4,2024-01-27 22:58:51,GraphVideo,"['affordablemakeup', 'makeup', 'princesspeachlips', 'glossylips', 'lipoil', 'makeuphacks', 'juicylips', 'drugstoremakeup', 'drugstoremakeupmusthaves']",True,audio_output/2024-01-27_22-58-51_UTC.mp3,"I cook cream soup. Taste is coco loco. Want me your white butt, shit ass.","I cook cream soup. Taste is coco loco. Want me your white butt, shit ass."
40,hydrationceo,C2m5xcRrzTr,,"I tried a TON of sunscreens last year and these are my honest opinions 🤔 

#sunscreen #sunscreenviral #elfsunscreen #firstaidbeautysunscreen #spf #spfreview #sunscreenreview #mineralspf #chemicalspf #skincare #skintips",2988,posts\2024-01-27_14-57-17_UTC.jpg,posts\2024-01-27_14-57-17_UTC.mp4,2024-01-27 14:57:17,GraphVideo,"['sunscreen', 'sunscreenviral', 'elfsunscreen', 'firstaidbeautysunscreen', 'spf', 'spfreview', 'sunscreenreview', 'mineralspf', 'chemicalspf', 'skincare', 'skintips']",True,audio_output/2024-01-27_14-57-17_UTC.mp3,"These are my thoughts on every single sunscreen I tried in 2023. Buckle in. Now this is expensive, but it is stunning. Looks gorgeous on the skin. It's 100% mineral. It's very lightweight. It gives you a little bit of glow. It does smell very strongly of oranges, but overall, love the sunscreen. I didn't even make a review on this because it just pilled immediately. I put it on, tried to put makeup on top of it, pill, pill, pill, city, not for me. This held me down this summer. It is a super lightweight, liquidy mineral sunscreen. Dries down matte. Now I wish this came in more shades, but it is a little bit of a tint, so it does offset that white cast a bit, but gorgeous sunscreen. This spray sunscreen is my favorite spray sunscreen that exists. It's affordable, it's super matte, it doesn't weigh your makeup down. So good. This is their version of the Supergoop Glow Screen, and I think they are pretty identical. Very glowy, tin man vibes, and the invisible sunscreen is great too. No white cast, and it doesn't bug my eyes that much. Solar Mate is gorgeous. It's a little bit of a matte slash skin-like finish. Super, super lightweight, blends in the skin well, doesn't irritate my skin at all. Neutrogena Mineral UV Tint. This stuff is so good. It's affordable, and it's a mineral sunscreen that comes in shades. Like, there's four shades in total, and I just wanna scream from the rooftop that all brands who are putting on mineral sunscreens should be doing this. This sunscreen is bomb. It is hydrating, it is glowy. I use this sunscreen all the time, and I love it. I hope this helps.","These are my thoughts on every single sunscreen I tried in 2023. Buckle in. Now this is expensive, but it is stunning. Looks gorgeous on the skin. It's 100% mineral. It's very lightweight. It gives you a little bit of glow. It does smell very strongly of oranges, but overall, love the sunscreen. I didn't even make a review on this because it just pilled immediately. I put it on, tried to put makeup on top of it, pill, pill, pill, city, not for me. This held me down this summer. It is a super lightweight, liquidy mineral sunscreen. Dries down matte. Now I wish this came in more shades, but it is a little bit of a tint, so it does offset that white cast a bit, but gorgeous sunscreen. This spray sunscreen is my favorite spray sunscreen that exists. It's affordable, it's super matte, it doesn't weigh your makeup down. So good. This is their version of the Supergoop Glow Screen, and I think they are pretty identical. Very glowy, tin man vibes, and the invisible sunscreen is great too. No white cast, and it doesn't bug my eyes that much. Solar Mate is gorgeous. It's a little bit of a matte slash skin-like finish. Super, super lightweight, blends in the skin well, doesn't irritate my skin at all. Neutrogena Mineral UV Tint. This stuff is so good. It's affordable, and it's a mineral sunscreen that comes in shades. Like, there's four shades in total, and I just wanna scream from the rooftop that all brands who are putting on mineral sunscreens should be doing this. This sunscreen is bomb. It is hydrating, it is glowy. I use this sunscreen all the time, and I love it. I hope this helps."
41,hydrationceo,C2lLA0ZLH0C,,"You DON’T have to spend a ton of money to have nice hydrated skin (even if you’re super reactive)! ☺️ @theordinary #theordinary #theordinarypartner 

#redskin #sensitiveskin #skincare #skincareroutine #theordinaryskincare #skincaretips #skincare101 #skintok",2246,posts\2024-01-26_22-49-59_UTC.jpg,posts\2024-01-26_22-49-59_UTC.mp4,2024-01-26 22:49:59,GraphVideo,"['theordinary', 'theordinarypartner', 'redskin', 'sensitiveskin', 'skincare', 'skincareroutine', 'theordinaryskincare', 'skincaretips', 'skincare101', 'skintok']",True,audio_output/2024-01-26_22-49-59_UTC.mp3,"Hi, if your skin looks like this, you need to put the 10-step skincare routine away. Look, the name of the game with red reactive skin is simple, gentle, effective products. We are using the Ordinary Glycolipid Cream Cleanser. It's not stripping, and it's not gonna freak out your skin barrier. And speaking of skin barrier, the Soothing and Barrier Support Serum from the Ordinary, aka the Pink Serum. This helps to reduce the look of redness and strengthen the skin barrier. Okay, now one of the greatest serums of all time, Ozlike Acid 10% Suspension. This is gonna target uneven skin tone and the look of redness. This is just a must-have for my blemish-prone girlies. Oh, so good. For moisturizer, we're going natural moisturizing factors plus phytoceramides. Super rich, super creamy. It helps to strengthen the skin barrier. It also just leaves the skin with like this insanely decadent glow. Like irritation, who, where? Anyway, four steps. It's all you need. Don't go crazy. Okay, bye. Love you, bye.","Hi, if your skin looks like this, you need to put the 10-step skincare routine away. Look, the name of the game with red reactive skin is simple, gentle, effective products. We are using the Ordinary Glycolipid Cream Cleanser. It's not stripping, and it's not gonna freak out your skin barrier. And speaking of skin barrier, the Soothing and Barrier Support Serum from the Ordinary, aka the Pink Serum. This helps to reduce the look of redness and strengthen the skin barrier. Okay, now one of the greatest serums of all time, Ozlike Acid 10% Suspension. This is gonna target uneven skin tone and the look of redness. This is just a must-have for my blemish-prone girlies. Oh, so good. For moisturizer, we're going natural moisturizing factors plus phytoceramides. Super rich, super creamy. It helps to strengthen the skin barrier. It also just leaves the skin with like this insanely decadent glow. Like irritation, who, where? Anyway, four steps. It's all you need. Don't go crazy. Okay, bye. Love you, bye."
42,hydrationceo,C2kxO8KpQkJ,,"Sunscreens are made to be difficult to remove, so oil UP 💦 

#sunscreen #skintips #skincare101 #beginnerskincare #spf #acneprone #acne #doublecleansing #oilcleansing #skincare #skincareroutine #cleanser #skintok",1699,posts\2024-01-26_19-04-31_UTC.jpg,posts\2024-01-26_19-04-31_UTC.mp4,2024-01-26 19:04:31,GraphVideo,"['sunscreen', 'skintips', 'skincare101', 'beginnerskincare', 'spf', 'acneprone', 'acne', 'doublecleansing', 'oilcleansing', 'skincare', 'skincareroutine', 'cleanser', 'skintok']",True,audio_output/2024-01-26_19-04-31_UTC.mp3,"It is not the sunscreen that's breaking you out, probably. It is the way that you take it off at the end of the day. Sunscreen is formulated to stay on your face all day, obviously. That's how it protects you from the sun. So you're going to take it off with a cleansing balm. This is a good one from Good Molecules. It's also extremely affordable. This oil is going to break down that sunscreen barrier, and it's also going to pull any of that sunscreen out of your pores, any of that dirt out of your pores, because oil attracts oil. That's why it's got to be an oil cleanser. I know it seems counterproductive to rub oil on your face, but I promise this is what works. And don't forget to emulsify with a little bit of water. It should turn kind of white and milky. And really, it should be like 30 seconds rubbing in and then 30 seconds emulsifying before you go to wash it off. After the oil cleanse, you just do a water-based cleanse. I normally use Hydro Boost. It's great. It's cheap. It's affordable. And that's to make sure that you aren't sleeping in sunscreen residue, which is always what makes me break out. Okay. Hope this helped. Bye.","It is not the sunscreen that's breaking you out, probably. It is the way that you take it off at the end of the day. Sunscreen is formulated to stay on your face all day, obviously. That's how it protects you from the sun. So you're going to take it off with a cleansing balm. This is a good one from Good Molecules. It's also extremely affordable. This oil is going to break down that sunscreen barrier, and it's also going to pull any of that sunscreen out of your pores, any of that dirt out of your pores, because oil attracts oil. That's why it's got to be an oil cleanser. I know it seems counterproductive to rub oil on your face, but I promise this is what works. And don't forget to emulsify with a little bit of water. It should turn kind of white and milky. And really, it should be like 30 seconds rubbing in and then 30 seconds emulsifying before you go to wash it off. After the oil cleanse, you just do a water-based cleanse. I normally use Hydro Boost. It's great. It's cheap. It's affordable. And that's to make sure that you aren't sleeping in sunscreen residue, which is always what makes me break out. Okay. Hope this helped. Bye."
43,hydrationceo,C2iMUrdpSa0,,"Vampire millennials forever 🧛‍♀️💕 

#twilightcolourpop #twilight #colourpop #makeupreview #vampires #colourpopreview #makeuptutorial #makeupblogger #makeupreels #vampiremakeup #teamjacob",3888,posts\2024-01-25_19-03-20_UTC.jpg,posts\2024-01-25_19-03-20_UTC.mp4,2024-01-25 19:03:20,GraphVideo,"['twilightcolourpop', 'twilight', 'colourpop', 'makeupreview', 'vampires', 'colourpopreview', 'makeuptutorial', 'makeupblogger', 'makeupreels', 'vampiremakeup', 'teamjacob']",True,audio_output/2024-01-25_19-03-20_UTC.mp3,"Yes, bitch, I spent $100 on the Twilight ColourPop collab. I got everything. We're gonna try it all out. My millennial fantasies have come true, but does it stack up? So palette is definitely giving like the first movie with that like blue filter. These are the colors. Let's throw together a look, people. Gotta use shade Bella. This is the look. Glitters are super glittery as ColourPop normally is. And I do love a cool tone palette, though I wish there were some deeper shades just so it would be a little bit more inclusive. Not everyone is vampire pale, ColourPop. I am, but I digress. These are the liquid liners, and they do have these quotes from the movies, which I love. Like, say it out loud. Vampire. We have Forever, Vampire, and Coven. Coven is like a black with some blue shimmer, so I'm gonna use that. Liner's not very opaque, so I'd probably skip. We got two highlighters, Vampire Skin and Meadow. Obviously, I'm going Vampire Skin. Oh, that is bananas. Three lip oils. This is shade Bells for your vampire blood. Team Jacob. Because that little wolf boy has my heart. I love a black gloss. And Team Edward is blue for some reason. Hate it. Okay, we're back to Jake. And bitch, I am trying to sparkle like Edward. This is called Light Diamonds. Should have been called the Skin of a Killer, but fine. Ooh, smells like coconut, which is kind of a weird scent for Edward. I feel like he smells like Team Angst, but this is pretty. And that's everything. Definitely some hits or misses, but I am praying they make a new Moon collection. Please, please, please, please, please. Okay, bye.","Yes, bitch, I spent $100 on the Twilight ColourPop collab. I got everything. We're gonna try it all out. My millennial fantasies have come true, but does it stack up? So palette is definitely giving like the first movie with that like blue filter. These are the colors. Let's throw together a look, people. Gotta use shade Bella. This is the look. Glitters are super glittery as ColourPop normally is. And I do love a cool tone palette, though I wish there were some deeper shades just so it would be a little bit more inclusive. Not everyone is vampire pale, ColourPop. I am, but I digress. These are the liquid liners, and they do have these quotes from the movies, which I love. Like, say it out loud. Vampire. We have Forever, Vampire, and Coven. Coven is like a black with some blue shimmer, so I'm gonna use that. Liner's not very opaque, so I'd probably skip. We got two highlighters, Vampire Skin and Meadow. Obviously, I'm going Vampire Skin. Oh, that is bananas. Three lip oils. This is shade Bells for your vampire blood. Team Jacob. Because that little wolf boy has my heart. I love a black gloss. And Team Edward is blue for some reason. Hate it. Okay, we're back to Jake. And bitch, I am trying to sparkle like Edward. This is called Light Diamonds. Should have been called the Skin of a Killer, but fine. Ooh, smells like coconut, which is kind of a weird scent for Edward. I feel like he smells like Team Angst, but this is pretty. And that's everything. Definitely some hits or misses, but I am praying they make a new Moon collection. Please, please, please, please, please. Okay, bye."
44,hydrationceo,C2fQ86wLRwr,,"It’s the drugstore liquid liner showdown 🤠 What affordable product do you want me to stress test next? 

#affordablemakeup #drugstoremakeup #drugstoreliquidliner #liquidliner #drugstoreeyeliner #eyeliner #eyelinertips #makeuptok #beautytok #lorealparis #revloncolorstay #nyxepicinkliner",15793,posts\2024-01-24_15-46-35_UTC.jpg,posts\2024-01-24_15-46-35_UTC.mp4,2024-01-24 15:46:35,GraphVideo,"['affordablemakeup', 'drugstoremakeup', 'drugstoreliquidliner', 'liquidliner', 'drugstoreeyeliner', 'eyeliner', 'eyelinertips', 'makeuptok', 'beautytok', 'lorealparis', 'revloncolorstay', 'nyxepicinkliner']",True,audio_output/2024-01-24_15-46-35_UTC.mp3,"On Monday, I tried the L'Oreal Paris Voluminous Superstar and I found that it was not very opaque, hardy to clean line. And the wear test was abysmal. Probably the worst eyeliner I've ever tried. It was so smudgy. On Tuesday, I tried the very popular NYX Epic Ink Liner, which claims to be waterproof. Now, I love the brush on this. It was super easy to get a nice wing, but this is why it's important to do a wear test because by the end of the day, a lot of it had fallen off of my face and it was pretty smudgy overall. On Wednesday, I tried the new NYX Vivid Matte Liquid Eyeliner and this does come with a brush tip, which I tend to like. Kind of gets like all over my eyelashes. But the wing was looking snatched, like very black, very matte, very opaque. Wear test was pretty good. I think she held on there. It wasn't like perfectly crisp, but I mean, pretty good for 12 hours. On Thursday, we tried the L'Oreal Paris Infallible The Super Slim and I'd heard lots about this. It's got a long felt tip, which was great. Very easy to get a nice sharp wing. Nice and black, nice and opaque. Y'all, it is many hours later and this slayed. Like this is worth the hype. No flaking, no smudging, no cracking. On Friday, I used the Revlon Colorstay Micro, which I've actually used for a while now just because I love the super, super tiny felt tip. Like the smaller and thinner the felt tip, I feel like the better. And this stuff truly is bulletproof. It lasts the whole day, no issues. Good. And the winner is the Revlon Colorstay Micro. This is the best. I think it is worlds better than even the Prestige brands that I've tried before. Of course, that's the one that I'm wearing on my eyes today. And I hope that this helped you. Okay, bye.","On Monday, I tried the L'Oreal Paris Voluminous Superstar and I found that it was not very opaque, hardy to clean line. And the wear test was abysmal. Probably the worst eyeliner I've ever tried. It was so smudgy. On Tuesday, I tried the very popular NYX Epic Ink Liner, which claims to be waterproof. Now, I love the brush on this. It was super easy to get a nice wing, but this is why it's important to do a wear test because by the end of the day, a lot of it had fallen off of my face and it was pretty smudgy overall. On Wednesday, I tried the new NYX Vivid Matte Liquid Eyeliner and this does come with a brush tip, which I tend to like. Kind of gets like all over my eyelashes. But the wing was looking snatched, like very black, very matte, very opaque. Wear test was pretty good. I think she held on there. It wasn't like perfectly crisp, but I mean, pretty good for 12 hours. On Thursday, we tried the L'Oreal Paris Infallible The Super Slim and I'd heard lots about this. It's got a long felt tip, which was great. Very easy to get a nice sharp wing. Nice and black, nice and opaque. Y'all, it is many hours later and this slayed. Like this is worth the hype. No flaking, no smudging, no cracking. On Friday, I used the Revlon Colorstay Micro, which I've actually used for a while now just because I love the super, super tiny felt tip. Like the smaller and thinner the felt tip, I feel like the better. And this stuff truly is bulletproof. It lasts the whole day, no issues. Good. And the winner is the Revlon Colorstay Micro. This is the best. I think it is worlds better than even the Prestige brands that I've tried before. Of course, that's the one that I'm wearing on my eyes today. And I hope that this helped you. Okay, bye."
45,hydrationceo,C2dyNTJrUtO,,"persona blush in jam is forever an icon, a legend, the undefeated reigning QUEEN of blushes and I will never forget her again (ok maybe I will but then just remind me that the perfect blush exists and it is HER) 💕 

#blush #blushtrend #berryblush #pinkblush #makeupreview #persona #douyinblush #makeuptok #hotpink #pinkmakeup",8084,posts\2024-01-24_01-58-01_UTC.jpg,posts\2024-01-24_01-58-01_UTC.mp4,2024-01-24 01:58:01,GraphVideo,"['blush', 'blushtrend', 'berryblush', 'pinkblush', 'makeupreview', 'persona', 'douyinblush', 'makeuptok', 'hotpink', 'pinkmakeup']",True,audio_output/2024-01-24_01-58-01_UTC.mp3,"This is the blush that all other blushes in my collection are trying to be, and could never be. Cause look at her, it looks like clown shit, right? This is the most beautiful, high pigmented blush I have ever put on my skin. And every time I forget her in my drawer, and then I remember her, I'm like, fuck, why am I using anything else? Look at this, like it's so creamy. It is so blendable, it is so beautiful. Is she a lipstick too? Yeah, she is. Tell me, I've never looked better. And I genuinely believe this would look good on every single person on planet earth. It's, it's gotta slay every time.","This is the blush that all other blushes in my collection are trying to be, and could never be. Cause look at her, it looks like clown shit, right? This is the most beautiful, high pigmented blush I have ever put on my skin. And every time I forget her in my drawer, and then I remember her, I'm like, fuck, why am I using anything else? Look at this, like it's so creamy. It is so blendable, it is so beautiful. Is she a lipstick too? Yeah, she is. Tell me, I've never looked better. And I genuinely believe this would look good on every single person on planet earth. It's, it's gotta slay every time."
